{
  "langId": "css",
  "coverage": "absent_by_design",
  "mechanism": "",
  "why": "",
  "useWhen": "",
  "price": "",
  "source": "https://developer.mozilla.org/en-US/docs/Web/CSS | https://www.w3.org/TR/css-cascade-5/",
  "authority": 8,
  "confidence": "HIGH",
  "absentReason": "CSS animations/transitions are time-driven by the engine. There is no CSS event loop or await.",
  "empowered_by": [],
  "dependsOn": [],
  "traceDown": [],
  "syntaxExample": null
}
