{
  "langId": "dart",
  "coverage": "verified",
  "mechanism": "VM tracing/generational collection. Not refcounting.",
  "why": "Same as Dart GC.",
  "useWhen": "Dart VM / Flutter.",
  "price": "You profile frames, you do not tune G1-style regions.",
  "source": "https://dart.dev/guides/language/memory-management",
  "authority": 8,
  "confidence": "HIGH",
  "syntaxExample": null,
  "empowered_by": [],
  "dependsOn": [],
  "traceDown": [],
  "absentReason": null
}
