{
  "langId": "typescript",
  "coverage": "absent_by_design",
  "mechanism": "",
  "why": "",
  "useWhen": "",
  "price": "",
  "source": "Language design / runtime docs",
  "authority": 8,
  "confidence": "HIGH",
  "absentReason": "JS engines are tracing collectors, not Swift-style ARC. Do not confuse `WeakRef` with refcounting.",
  "empowered_by": [],
  "dependsOn": [],
  "traceDown": [],
  "syntaxExample": null
}
