{
  "langId": "typescript",
  "coverage": "absent_by_design",
  "mechanism": "",
  "why": "",
  "useWhen": "",
  "price": "",
  "source": "https://www.typescriptlang.org/docs/handbook/2/basic-types.html | https://developer.mozilla.org/en-US/docs/Web/JavaScript/Memory_management",
  "authority": 8,
  "confidence": "HIGH",
  "absentReason": "No borrow checker. `readonly` is a type-level hint, erased, not enforced against mutation through aliases.",
  "empowered_by": [],
  "dependsOn": [],
  "traceDown": [],
  "syntaxExample": null
}
