{
  "langId": "javascript",
  "coverage": "absent_by_design",
  "mechanism": "",
  "why": "",
  "useWhen": "",
  "price": "",
  "source": "Language design / runtime docs",
  "authority": 8,
  "confidence": "HIGH",
  "absentReason": "The language is single-threaded per isolate. Workers do not share the JS heap.",
  "empowered_by": [],
  "dependsOn": [],
  "traceDown": [],
  "syntaxExample": null
}
