{
  "langId": "dart",
  "coverage": "absent_by_design",
  "mechanism": "",
  "why": "",
  "useWhen": "",
  "price": "",
  "source": "Language design / runtime docs",
  "authority": 8,
  "confidence": "HIGH",
  "absentReason": "Dart VM is tracing GC, not ARC. Do not map Flutter to Swift here.",
  "empowered_by": [],
  "dependsOn": [],
  "traceDown": [],
  "syntaxExample": null
}
