{
  "langId": "javascript",
  "coverage": "absent_by_design",
  "mechanism": "",
  "why": "",
  "useWhen": "",
  "price": "",
  "source": "Language design / runtime docs",
  "authority": 8,
  "confidence": "HIGH",
  "absentReason": "No affine types or borrow checker. GC owns lifetime. `using` is resource RAII, not memory ownership.",
  "empowered_by": [],
  "dependsOn": [],
  "traceDown": [],
  "syntaxExample": null
}
