{
  "langId": "javascript",
  "coverage": "absent_by_design",
  "mechanism": "",
  "why": "",
  "useWhen": "",
  "price": "",
  "source": "https://v8.dev/blog/trash-talk | https://developer.mozilla.org/en-US/docs/Web/JavaScript/Memory_management",
  "authority": 8,
  "confidence": "HIGH",
  "absentReason": "Engines trace; they do not expose ARC.",
  "empowered_by": [],
  "dependsOn": [],
  "traceDown": [],
  "syntaxExample": null
}
