{
  "langId": "dart",
  "coverage": "absent_by_design",
  "mechanism": "",
  "why": "",
  "useWhen": "",
  "price": "",
  "source": "https://en.wikipedia.org/wiki/Dependent_type | https://dart.dev/null-safety",
  "authority": 8,
  "confidence": "HIGH",
  "absentReason": "No dependent types.",
  "empowered_by": [],
  "dependsOn": [],
  "traceDown": [],
  "syntaxExample": null
}
