{
  "langId": "dart",
  "coverage": "absent_by_design",
  "mechanism": "",
  "why": "",
  "useWhen": "",
  "price": "",
  "source": "Language design / runtime docs",
  "authority": 8,
  "confidence": "HIGH",
  "absentReason": "No borrow checker. Object identity and mutability are runtime facts. `final` is single-assignment, not unique ownership.",
  "empowered_by": [],
  "dependsOn": [],
  "traceDown": [],
  "syntaxExample": null
}
