{
  "langId": "dart",
  "coverage": "absent_by_design",
  "mechanism": "",
  "why": "",
  "useWhen": "",
  "price": "",
  "source": "https://en.wikipedia.org/wiki/Hindley%E2%80%93Milner_type_system | https://dart.dev/language/type-system",
  "authority": 8,
  "confidence": "HIGH",
  "absentReason": "Dart inference is local/flow-based, not Hindley\u2013Milner. You still annotate public APIs.",
  "empowered_by": [],
  "dependsOn": [],
  "traceDown": [],
  "syntaxExample": null
}
